news_headline,news_article,news_category,full_text,clean_text
Get local treatment: China to citizens abroad with coronavirus symptoms,"Chinese citizens overseas with coronavirus symptoms should get treatment locally to prevent the trans-border spread of the virus, a government official said. The country has recently detected new virus cases involving people who have travelled from countries reporting a surge in virus cases, including Iran and Italy. China has reported over 3,000 coronavirus deaths and over 80,000 virus cases. ",world,"Get local treatment: China to citizens abroad with coronavirus symptoms. Chinese citizens overseas with coronavirus symptoms should get treatment locally to prevent the trans-border spread of the virus, a government official said. The country has recently detected new virus cases involving people who have travelled from countries reporting a surge in virus cases, including Iran and Italy. China has reported over 3,000 coronavirus deaths and over 80,000 virus cases. ",get local treatment china citizen abroad coronavirus symptom chinese citizen overseas coronavirus symptom get treatment locally prevent tran border spread virus government official say country recently detect new virus case involve people travel country report surge virus case include iran italy china report coronavirus death virus case
Couple aboard coronavirus-hit California ship sues operator for $1mn,"A Florida couple who was aboard the Grand Princess cruise ship off the California coast has sued Princess Cruise Lines for over $1 million for causing them ""emotional distress and trauma"" over coronavirus. Ronald and Eva Weissberger said passengers were not examined or screened before they got on the vessel even though the ship was infected from two previous passengers.",world,"Couple aboard coronavirus-hit California ship sues operator for $1mn. A Florida couple who was aboard the Grand Princess cruise ship off the California coast has sued Princess Cruise Lines for over $1 million for causing them ""emotional distress and trauma"" over coronavirus. Ronald and Eva Weissberger said passengers were not examined or screened before they got on the vessel even though the ship was infected from two previous passengers.",couple aboard coronavirus hit california ship sue operator mn florida couple aboard grand princess cruise ship california coast sue princess cruise line million cause emotional distress trauma coronavirus ronald eva weissberger say passenger not examine screen get vessel even though ship infect two previous passenger
"Iran's coronavirus death toll rises to 291, total cases over 8,000","Iran's coronavirus death toll rose to 291 and 8,084 virus cases were detected, the country's Health Ministry spokesman Kianush Jahanpur said. In the past 24 hours, 881 new infections were detected while 54 more people had died due to it in Iran, Jahanpur added. Iran recently released 70,000 prisoners due to the virus outbreak, Iranian judiciary chief Ebrahim Raisi said.",world,"Iran's coronavirus death toll rises to 291, total cases over 8,000. Iran's coronavirus death toll rose to 291 and 8,084 virus cases were detected, the country's Health Ministry spokesman Kianush Jahanpur said. In the past 24 hours, 881 new infections were detected while 54 more people had died due to it in Iran, Jahanpur added. Iran recently released 70,000 prisoners due to the virus outbreak, Iranian judiciary chief Ebrahim Raisi said.",iran coronavirus death toll rise total case iran coronavirus death toll rise virus case detect country health ministry spokesman kianush jahanpur say past hour new infection detect people die due iran jahanpur add iran recently release prisoner due virus outbreak iranian judiciary chief ebrahim raisi say
Over 130 Indians onboard coronavirus-hit US cruise ship,"Over 130 Indians are onboard the US cruise ship that has reported 21 coronavirus cases, Princess Cruises, owner of the ship, said. The ship, which has over 3,500 passengers and crew on board, is docked at Port of Oakland. Most of the virus cases on the ship are crew members, US Vice President Mike Pence said.",world,"Over 130 Indians onboard coronavirus-hit US cruise ship. Over 130 Indians are onboard the US cruise ship that has reported 21 coronavirus cases, Princess Cruises, owner of the ship, said. The ship, which has over 3,500 passengers and crew on board, is docked at Port of Oakland. Most of the virus cases on the ship are crew members, US Vice President Mike Pence said.",indians onboard coronavirus hit us cruise ship indian onboard us cruise ship report coronavirus case princess cruise owner ship say ship passenger crew board dock port oakland virus case ship crew member us vice president mike penny say
Thailand suspends visa-on-arrival for India and 17 other countries,"Thailand on Wednesday announced that it is suspending visa-on-arrival facility for India and 17 other countries to prevent the spread of the new coronavirus, the country's interior minister said. The country also cancelled visa exemption for South Korea, Italy and Hong Kong, the minister added. Thailand has reported 1 coronavirus death and detected 59 virus cases.",world,"Thailand suspends visa-on-arrival for India and 17 other countries. Thailand on Wednesday announced that it is suspending visa-on-arrival facility for India and 17 other countries to prevent the spread of the new coronavirus, the country's interior minister said. The country also cancelled visa exemption for South Korea, Italy and Hong Kong, the minister added. Thailand has reported 1 coronavirus death and detected 59 virus cases.",thailand suspend visa arrival india country thailand wednesday announce suspend visa arrival facility india country prevent spread new coronavirus countrys interior minister say country also cancel visa exemption south korea italy hong kong minister add thailand report coronavirus death detect virus case
Putin supports amendment which would allow him to run for Prez in 2024,"Russian President Vladimir Putin told the Parliament that a constitutional amendment that would allow him to run for president in 2024 could be adopted if Russia's Constitutional Court didn't object. If approved, the move will allow Putin to serve two back-to-back six-year terms. According to the current constitution, Putin has to step down in 2024 after his term ends.",world,"Putin supports amendment which would allow him to run for Prez in 2024. Russian President Vladimir Putin told the Parliament that a constitutional amendment that would allow him to run for president in 2024 could be adopted if Russia's Constitutional Court didn't object. If approved, the move will allow Putin to serve two back-to-back six-year terms. According to the current constitution, Putin has to step down in 2024 after his term ends.",putin support amendment would allow run prez russian president vladimir putin tell parliament constitutional amendment would allow run president could adopt russia constitutional court not object approve move allow putin serve two back back six year term accord current constitution putin step term end
Pilot killed after F-16 jet crashes during Pak Day parade rehearsals,"An F-16 jet belonging to the Pakistan Air Force (PAF) crashed while rehearsing for Pakistan Day air show to be held on March 23. ""Wing Commander Noman Akram embraced martyrdom in the crash,"" an air force spokesman said. There's a little chance of any casualties on the ground because the crash site is a deserted area, a district official said.",world,"Pilot killed after F-16 jet crashes during Pak Day parade rehearsals. An F-16 jet belonging to the Pakistan Air Force (PAF) crashed while rehearsing for Pakistan Day air show to be held on March 23. ""Wing Commander Noman Akram embraced martyrdom in the crash,"" an air force spokesman said. There's a little chance of any casualties on the ground because the crash site is a deserted area, a district official said.",pilot kill f jet crash pak day parade rehearsal f jet belong pakistan air force paf crash rehearse pakistan day air show hold march wing commander noman akram embrace martyrdom crash air force spokesman say little chance casualty ground crash site deserted area district official say
Germany's Berlin to take up to 100 children from Greek refugee camps,"Berlin, Germany's capital, will take in 80 to 100 children from Greek refugee camps, a German official said. Over 3,000 children in Greece need to be found homes, UNICEF, a United Nations' (UN) agency, said. Thousands of migrants have gathered at Greece's border, hoping to cross into Europe, after Turkey removed its restrictions on their movements.",world,"Germany's Berlin to take up to 100 children from Greek refugee camps. Berlin, Germany's capital, will take in 80 to 100 children from Greek refugee camps, a German official said. Over 3,000 children in Greece need to be found homes, UNICEF, a United Nations' (UN) agency, said. Thousands of migrants have gathered at Greece's border, hoping to cross into Europe, after Turkey removed its restrictions on their movements.",germanys berlin take child greek refugee camp berlin germanys capital take child greek refugee camp german official say child greece need find home unicef united nation un agency say thousand migrant gather greece border hop cross europe turkey remove restriction movement
"Afghanistan government to release 1,500 Taliban prisoners","Afghan President Ashraf Ghani signed a decree and is set to release 1,500 Taliban prisoners to pave the way for direct talks with the insurgent group aimed at ending 18-year-long war in Afghanistan. All released Taliban prisoners will have to provide ""a written guarantee to not return to the battlefield"". Earlier, the US signed a peace deal with the Taliban.",world,"Afghanistan government to release 1,500 Taliban prisoners. Afghan President Ashraf Ghani signed a decree and is set to release 1,500 Taliban prisoners to pave the way for direct talks with the insurgent group aimed at ending 18-year-long war in Afghanistan. All released Taliban prisoners will have to provide ""a written guarantee to not return to the battlefield"". Earlier, the US signed a peace deal with the Taliban.",afghanistan government release taliban prisoner afghan president ashraf ghani sign decree set release taliban prisoner pave way direct talk insurgent group aim end year long war afghanistan release taliban prisoner provide write guarantee not return battlefield earlier us sign peace deal taliban
Shooting has damaged me for life: 35-yr-old NZ mosque attack survivor,"Sheikh Hasan Rubel, a man shot three times by an armed attacker who stormed the Al Noor mosque in Christchurch last year, said the incident has left him physically and mentally damaged for life. The 35-year-old was offering prayers at the mosque when the attacker, who streamed it live on Facebook, killed 51 worshippers and injured dozens of others.",world,"Shooting has damaged me for life: 35-yr-old NZ mosque attack survivor. Sheikh Hasan Rubel, a man shot three times by an armed attacker who stormed the Al Noor mosque in Christchurch last year, said the incident has left him physically and mentally damaged for life. The 35-year-old was offering prayers at the mosque when the attacker, who streamed it live on Facebook, killed 51 worshippers and injured dozens of others.",shooting damage life yr old nz mosque attack survivor sheikh hasan rubel man shoot three time armed attacker storm al noor mosque christchurch last year say incident leave physically mentally damage life year old offer prayer mosque attacker stream live facebook kill worshipper injure dozen
