news_headline,news_article,news_category,full_text,clean_text
"Microsoft, 35 other firms disrupt botnet that infected 9 mn computers","Microsoft and 35 other companies have disrupted a botnet, Necurs, which infected nine million computers worldwide and is one of the largest spam email networks. Necurs was disrupted using a domain via an algorithm that predicted over six million domains possibly created in future. Necurs was discovered in 2012 by Microsoft and carried out stock scams and fake pharmaceutical spams.",technology,"Microsoft, 35 other firms disrupt botnet that infected 9 mn computers. Microsoft and 35 other companies have disrupted a botnet, Necurs, which infected nine million computers worldwide and is one of the largest spam email networks. Necurs was disrupted using a domain via an algorithm that predicted over six million domains possibly created in future. Necurs was discovered in 2012 by Microsoft and carried out stock scams and fake pharmaceutical spams.",microsoft firm disrupt botnet infect mn computer microsoft company disrupt botnet necur infect nine million computer worldwide one large spam email network necur disrupt use domain via algorithm predict six million domain possibly create future necur discover microsoft carry stock scam fake pharmaceutical spam
"Facebook appoints two new directors, making board 40% female","Facebook has appointed two new directors, namely Tracey Travis, the CFO of cosmetics company Estée Lauder and former McKinsey & Co executive Nancy Killefer, who served in the US Treasury Department during the Obama administration. Their addition makes Facebook's board of directors 40% female. The other female board members include Facebook COO Sheryl Sandberg and PayPal Executive VP Peggy Alford.",technology,"Facebook appoints two new directors, making board 40% female. Facebook has appointed two new directors, namely Tracey Travis, the CFO of cosmetics company Estée Lauder and former McKinsey & Co executive Nancy Killefer, who served in the US Treasury Department during the Obama administration. Their addition makes Facebook's board of directors 40% female. The other female board members include Facebook COO Sheryl Sandberg and PayPal Executive VP Peggy Alford.",facebook appoint two new director make board female facebook appoint two new director namely tracey travis cfo cosmetic company estee lauder former mckinsey co executive nancy killefer serve us treasury department obama administration addition make facebook board director female female board member include facebook coo sheryl sandberg paypal executive vp peggy alford
PUBG Mobile Pro League to be held online amid coronavirus fears,"With the growing concerns over the coronavirus outbreak, Tencent Games announced PUBG Mobile Pro League being converted to an online-only event. The developer announced that the event will take place on its scheduled date March 19, ""without our fan and audience presence"". ""We take...the public health very seriously. We adhere to all the guidance and recommended precautionary measures,"" it added.",technology,"PUBG Mobile Pro League to be held online amid coronavirus fears. With the growing concerns over the coronavirus outbreak, Tencent Games announced PUBG Mobile Pro League being converted to an online-only event. The developer announced that the event will take place on its scheduled date March 19, ""without our fan and audience presence"". ""We take...the public health very seriously. We adhere to all the guidance and recommended precautionary measures,"" it added.",pubg mobile pro league hold online amid coronavirus fear grow concern coronavirus outbreak tencent game announce pubg mobile pro league convert online event developer announce event take place schedule date march without fan audience presence take public health seriously adhere guidance recommend precautionary measure add
Google and Dutch startup create AI glasses to help the blind 'see',"Google AI has partnered with a Dutch startup to create AI-powered glasses that can help the blind and visually-impaired people ""see"". The glasses, developed by Envision, can get visual details from images of people and public transport, among other things, and speak to the user. It can also read texts from books, identify friends and describe surroundings to the person.",technology,"Google and Dutch startup create AI glasses to help the blind 'see'. Google AI has partnered with a Dutch startup to create AI-powered glasses that can help the blind and visually-impaired people ""see"". The glasses, developed by Envision, can get visual details from images of people and public transport, among other things, and speak to the user. It can also read texts from books, identify friends and describe surroundings to the person.",google dutch startup create ai glass help blind see google ai partner dutch startup create ai power glass help blind visually impair people see glass develop envision get visual detail image people public transport among thing speak user also read text book identify friend describe surrounding person
A footballer once helped end civil war in his country,"Chelsea legend Didier Drogba appealed to the warring factions in Ivory Coast to end the civil war, just after the country qualified for 2006 FIFA World Cup. Drogba, who turns 42 today, made the appeal on national television from the team's dressing room. The government and the opposing forces agreed to start peace talks, following which a ceasefire was announced.",sports,"A footballer once helped end civil war in his country. Chelsea legend Didier Drogba appealed to the warring factions in Ivory Coast to end the civil war, just after the country qualified for 2006 FIFA World Cup. Drogba, who turns 42 today, made the appeal on national television from the team's dressing room. The government and the opposing forces agreed to start peace talks, following which a ceasefire was announced.",footballer help end civil war country chelsea legend didier drogba appeal war faction ivory coast end civil war country qualify fifa world cup drogba turn today make appeal national television team dressing room government oppose force agree start peace talk follow ceasefire announce
Brazilian football legend Ronaldinho's first picture from Paraguay jail emerges,"Brazilian football legend Ronaldinho's first image as a prisoner in a Paraguayan jail emerged online after he was caught with fake documents. Earlier, Ronaldinho and his brother were taken in handcuffs to a courthouse on Saturday following their arrest. Ronaldinho said the documents were offered as a gift by a Brazilian businessman, Wilmondes Sousa Liria, who has been jailed.",sports,"Brazilian football legend Ronaldinho's first picture from Paraguay jail emerges. Brazilian football legend Ronaldinho's first image as a prisoner in a Paraguayan jail emerged online after he was caught with fake documents. Earlier, Ronaldinho and his brother were taken in handcuffs to a courthouse on Saturday following their arrest. Ronaldinho said the documents were offered as a gift by a Brazilian businessman, Wilmondes Sousa Liria, who has been jailed.",brazilian football legend ronaldinhos first picture paraguay jail emerge brazilian football legend ronaldinhos first image prisoner paraguayan jail emerge online catch fake document earlier ronaldinho brother take handcuff courthouse saturday follow arrest ronaldinho say document offer gift brazilian businessman wilmonde sousa liria jail
Why was one umpire officiating from both ends during ongoing Ranji Trophy final?,Umpire KN Ananthapadmanabhan officiated from both ends during second day of Ranji Trophy final between Bengal and Saurashtra. Umpire Chettithody Shamshuddin was forced to stay off the field as he got injured after being hit by a ball around the lower abdomen area. The other available umpire Piyush Kakkar was only handed square-leg umpire duties as he was a local.,sports,Why was one umpire officiating from both ends during ongoing Ranji Trophy final?. Umpire KN Ananthapadmanabhan officiated from both ends during second day of Ranji Trophy final between Bengal and Saurashtra. Umpire Chettithody Shamshuddin was forced to stay off the field as he got injured after being hit by a ball around the lower abdomen area. The other available umpire Piyush Kakkar was only handed square-leg umpire duties as he was a local.,one umpire officiating end ongoing ranji trophy final umpire kn ananthapadmanabhan officiate end second day ranji trophy final bengal saurashtra umpire chettithody shamshuddin force stay field get injure hit ball around low abdomen area available umpire piyush kakkar hand square leg umpire duty local
Avoid selfies and autographs: ECB asks England cricketers in Sri Lanka,"The England and Wales Cricket Board (ECB) has asked players to refrain from ""any unnecessary public engagements"" on their Sri Lanka tour. The ECB urged players to avoid taking selfies and signing autographs amid coronavirus outbreak. It also urged fans to ""maintain good levels of hygiene"". Earlier, England captain Joe Root had said they won't shake hands during the tour.",sports,"Avoid selfies and autographs: ECB asks England cricketers in Sri Lanka. The England and Wales Cricket Board (ECB) has asked players to refrain from ""any unnecessary public engagements"" on their Sri Lanka tour. The ECB urged players to avoid taking selfies and signing autographs amid coronavirus outbreak. It also urged fans to ""maintain good levels of hygiene"". Earlier, England captain Joe Root had said they won't shake hands during the tour.",avoid selfie autograph ecb ask england cricketer sri lanka england wale cricket board ecb ask player refrain unnecessary public engagement sri lanka tour ecb urge player avoid take selfie sign autograph amid coronavirus outbreak also urge fan maintain good level hygiene earlier england captain joe root say not shake hand tour
Australian cricketer Ben Dunk reveals why he chews gum while batting,"Australian cricketer Ben Dunk, who has slammed two 90s in the ongoing Pakistan Super League for Lahore Qalandars, has revealed that he chews gum while batting to remain focused on the task. ""There is nothing special in the gum...It is perhaps not such a good habit,"" he said. ""I only chew gum to stay calm,"" he further said.",sports,"Australian cricketer Ben Dunk reveals why he chews gum while batting. Australian cricketer Ben Dunk, who has slammed two 90s in the ongoing Pakistan Super League for Lahore Qalandars, has revealed that he chews gum while batting to remain focused on the task. ""There is nothing special in the gum...It is perhaps not such a good habit,"" he said. ""I only chew gum to stay calm,"" he further said.",australian cricketer ben dunk reveal chew gum batting australian cricketer ben dunk slam two ongoing pakistan super league lahore qalandar reveal chew gum batting remain focused task nothing special gum perhaps not good habit say chew gum stay calm say
There were times I didn't want to come back: Smith told team after serving ban,"In his first meeting with Australian players after returning from one-year ban, Steve Smith told them, ""It was pretty tough and I have had times where I probably didn't want to come back and play."" Meanwhile, David Warner told his teammates, ""How we have been accepted in the past 24 hours. I don't really feel like I've left.""",sports,"There were times I didn't want to come back: Smith told team after serving ban. In his first meeting with Australian players after returning from one-year ban, Steve Smith told them, ""It was pretty tough and I have had times where I probably didn't want to come back and play."" Meanwhile, David Warner told his teammates, ""How we have been accepted in the past 24 hours. I don't really feel like I've left.""",time not want come back smith tell team serve ban first meeting australian player return one year ban steve smith tell pretty tough time probably not want come back play meanwhile david warner tell teammate accept past hour not really feel like leave
"Mumbai-Maharashtra match once featured record 2,376 runs, 9 tons","The Ranji Trophy semi-final match between Mumbai and Maharashtra which ended on March 11, 1949, is the highest-scoring match in first-class history. A total of 2,376 runs and nine hundreds were scored in the match, while bowlers took 37 wickets and a batsman was retired hurt. Mumbai went on to win the match by 354 runs.",sports,"Mumbai-Maharashtra match once featured record 2,376 runs, 9 tons. The Ranji Trophy semi-final match between Mumbai and Maharashtra which ended on March 11, 1949, is the highest-scoring match in first-class history. A total of 2,376 runs and nine hundreds were scored in the match, while bowlers took 37 wickets and a batsman was retired hurt. Mumbai went on to win the match by 354 runs.",mumbai maharashtra match featured record run ton ranji trophy semi final match mumbai maharashtra end march high score match first class history total run nine hundred score match bowler take wicket batsman retire hurt mumbai go win match run
I will be surprised if anybody turns up to watch Australia-NZ ODI series: Clarke,"Ex-Australia captain Michael Clarke has criticised the timing of hosting New Zealand for an ODI series, calling them ""token games"". ""Cricket season is finished. What a great way to finish it with women winning World Cup as well. I'll be very surprised if anybody turns up to watch those games,"" he added. The three-match series will begin on March 13.",sports,"I will be surprised if anybody turns up to watch Australia-NZ ODI series: Clarke. Ex-Australia captain Michael Clarke has criticised the timing of hosting New Zealand for an ODI series, calling them ""token games"". ""Cricket season is finished. What a great way to finish it with women winning World Cup as well. I'll be very surprised if anybody turns up to watch those games,"" he added. The three-match series will begin on March 13.",surprised anybody turn watch australia nz odi series clarke ex australia captain michael clarke criticise timing host new zealand odi series call token game cricket season finish great way finish woman win world cup well surprised anybody turn watch game add three match series begin march
"Big fan of AB de Villiers, but his return would upset few players: Jonty Rhodes","Ex-South Africa cricketer Jonty Rhodes has said he's a big fan of AB de Villiers but his return to international cricket would upset a few players. However, he added, ""It'll just be great to see De Villiers play at a World Cup again for us."" De Villiers has said he would love to represent South Africa in T20 World Cup.",sports,"Big fan of AB de Villiers, but his return would upset few players: Jonty Rhodes. Ex-South Africa cricketer Jonty Rhodes has said he's a big fan of AB de Villiers but his return to international cricket would upset a few players. However, he added, ""It'll just be great to see De Villiers play at a World Cup again for us."" De Villiers has said he would love to represent South Africa in T20 World Cup.",big fan ab de villier return would upset player jonty rhode ex south africa cricketer jonty rhode say big fan ab de villier return international cricket would upset player however add great see de villiers play world cup us de villiers say would love represent south africa world cup
"If we don't use saliva, how'll we shine ball: Bhuvneshwar amid coronavirus scare","Ahead of the first ODI against South Africa, India pacer Bhuvneshwar Kumar said the bowlers have thought about not using saliva to shine the ball but a decision will be taken by team doctor. ""If we don't use saliva...then how'll we shine the ball. Then we'll get hit and you people will say you are not bowling well,"" he said.",sports,"If we don't use saliva, how'll we shine ball: Bhuvneshwar amid coronavirus scare. Ahead of the first ODI against South Africa, India pacer Bhuvneshwar Kumar said the bowlers have thought about not using saliva to shine the ball but a decision will be taken by team doctor. ""If we don't use saliva...then how'll we shine the ball. Then we'll get hit and you people will say you are not bowling well,"" he said.",not use saliva shine ball bhuvneshwar amid coronavirus scare ahead first odi south africa india pacer bhuvneshwar kumar say bowler think not use saliva shine ball decision take team doctor not use saliva shine ball get hit people say not bowl well say
"Fan requests BCCI to call Irfan back from retirement, ex-cricketer responds","After Irfan Pathan scored 57*(31) for India Legends against Sri Lanka Legends, a fan requested BCCI to call him back from retirement. Responding to the fan, Irfan wrote, ""Haha too late I guess."" Another fan said IPL franchises should reconsider their decision of not taking him in their team, to which Irfan said, ""Times gone now. Thank u.""",sports,"Fan requests BCCI to call Irfan back from retirement, ex-cricketer responds. After Irfan Pathan scored 57*(31) for India Legends against Sri Lanka Legends, a fan requested BCCI to call him back from retirement. Responding to the fan, Irfan wrote, ""Haha too late I guess."" Another fan said IPL franchises should reconsider their decision of not taking him in their team, to which Irfan said, ""Times gone now. Thank u.""",fan request bcci call irfan back retirement ex cricketer respond irfan pathan score india legend sri lanka legend fan request bcci call back retirement respond fan irfan write haha late guess another fan say ipl franchise reconsider decision not take team irfan say time go thank u
Italian league which features Ronaldo suspended amid lockdown over coronavirus,"Italian Prime Minister Giuseppe Conte has announced the suspension of country's top football league Serie A until April 3 over the coronavirus outbreak. Italy has been put under lockdown with the latest figures revealing 463 deaths and 9,172 infected with coronavirus. In the Champions League, Juventus are due to host Lyon in the last 16, second leg on March 17.",sports,"Italian league which features Ronaldo suspended amid lockdown over coronavirus. Italian Prime Minister Giuseppe Conte has announced the suspension of country's top football league Serie A until April 3 over the coronavirus outbreak. Italy has been put under lockdown with the latest figures revealing 463 deaths and 9,172 infected with coronavirus. In the Champions League, Juventus are due to host Lyon in the last 16, second leg on March 17.",italian league feature ronaldo suspend amid lockdown coronavirus italian prime minister giuseppe conte announce suspension countrys top football league serie april coronavirus outbreak italy put lockdown late figure reveal death infect coronavirus champion league juventus due host lyon last second leg march
Barcelona's Champions League match to be played behind closed doors,"Barcelona's Champions League round of 16 second leg match against Napoli will be played behind closed doors because of the coronavirus outbreak. Two other Champions League matches - Valencia against Atalanta in Spain and Paris Saint-Germain vs Borussia Dortmund in France - will also be held in empty stadiums. The total number of coronavirus cases has crossed 1,16,000 globally. ",sports,"Barcelona's Champions League match to be played behind closed doors. Barcelona's Champions League round of 16 second leg match against Napoli will be played behind closed doors because of the coronavirus outbreak. Two other Champions League matches - Valencia against Atalanta in Spain and Paris Saint-Germain vs Borussia Dortmund in France - will also be held in empty stadiums. The total number of coronavirus cases has crossed 1,16,000 globally. ",barcelonas champion league match play behind closed door barcelonas champion league round second leg match napoli play behind closed door coronavirus outbreak two champion league match valencia atalanta spain paris saint germain vs borussia dortmund france also hold empty stadium total number coronavirus case cross globally
La Liga matches to be played in empty stadiums amid coronavirus outbreak,"All La Liga matches will be played behind closed doors until at least March 22 over coronavirus outbreak, said the top Spanish league on Tuesday. The matches affected include Lionel Messi's side Barcelona's matches against Leganes and Mallorca. Spain has reported at least 1,650 confirmed cases of coronavirus with 35 deaths due to it.",sports,"La Liga matches to be played in empty stadiums amid coronavirus outbreak. All La Liga matches will be played behind closed doors until at least March 22 over coronavirus outbreak, said the top Spanish league on Tuesday. The matches affected include Lionel Messi's side Barcelona's matches against Leganes and Mallorca. Spain has reported at least 1,650 confirmed cases of coronavirus with 35 deaths due to it.",la liga match play empty stadium amid coronavirus outbreak la liga match play behind closed door least march coronavirus outbreak say top spanish league tuesday match affect include lionel messis side barcelonas match legane mallorca spain report least confirm case coronavirus death due
Mahim Verma set to resign as BCCI Vice President,"Mahim Verma, the current BCCI Vice President is set to resign after being elected as Secretary at the Cricket Association of Uttarakhand. As per the BCCI constitution, one person cannot hold two posts simultaneously. Former IPL chairman Rajeev Shukla is reportedly the front-runner to succeed Verma subject to him fulfilling the qualification.",sports,"Mahim Verma set to resign as BCCI Vice President. Mahim Verma, the current BCCI Vice President is set to resign after being elected as Secretary at the Cricket Association of Uttarakhand. As per the BCCI constitution, one person cannot hold two posts simultaneously. Former IPL chairman Rajeev Shukla is reportedly the front-runner to succeed Verma subject to him fulfilling the qualification.",mahim verma set resign bcci vice president mahim verma current bcci vice president set resign elect secretary cricket association uttarakhand per bcci constitution one person not hold two post simultaneously former ipl chairman rajeev shukla reportedly front runner succeed verma subject fulfil qualification
Wow! That's something: India's 1st +91kg boxer after qualifying for Olympics,"After becoming the first Indian boxer to qualify for Olympics in the super heavyweight +91kg category, Satish Kumar said, ""Wow! That's quite something."" Kumar added that ""nothing"" in his 10-year-long career is compared to his Olympic qualification. ""Last two years have by far been the best of my career...I don't have words to express how happy I am,"" he said.",sports,"Wow! That's something: India's 1st +91kg boxer after qualifying for Olympics. After becoming the first Indian boxer to qualify for Olympics in the super heavyweight +91kg category, Satish Kumar said, ""Wow! That's quite something."" Kumar added that ""nothing"" in his 10-year-long career is compared to his Olympic qualification. ""Last two years have by far been the best of my career...I don't have words to express how happy I am,"" he said.",wow something indias st kg boxer qualify olympic become first indian boxer qualify olympic super heavyweight kg category satish kumar say wow quite something kumar add nothing year long career compare olympic qualification last two year far good career not word express happy say
Rahul is a great entertainer: Brian Lara names favourite cricketer,"Former West Indies captain Brian Lara has named India batsman KL Rahul as his favourite cricketer. ""Rahul is just class. He is a great entertainer and a great person to watch bat,"" Lara said. On the ICC's proposal of four-day Tests, Lara said that the number of days doesn't matter if the ""game is going to end in a result"". ",sports,"Rahul is a great entertainer: Brian Lara names favourite cricketer. Former West Indies captain Brian Lara has named India batsman KL Rahul as his favourite cricketer. ""Rahul is just class. He is a great entertainer and a great person to watch bat,"" Lara said. On the ICC's proposal of four-day Tests, Lara said that the number of days doesn't matter if the ""game is going to end in a result"". ",rahul great entertainer brian lara name favourite cricketer former west indie captain brian lara name india batsman kl rahul favourite cricketer rahul class great entertainer great person watch bat lara say iccs proposal four day test lara say number day not matter game go end result
"Amit Panghal, Lovlina Borgohain settle for bronze at Asian Olympic Qualifiers","Boxers Amit Panghal and Lovlina Borgohain won bronze after losing in their respective semi-final matches at the ongoing Asian Olympic Qualifiers in Jordan. However, both the boxers have secured their Olympic berths by virtue of entering the semifinals. Meanwhile, India's Vikas Krishan has entered the final bout in the welterweight 69kg event. ",sports,"Amit Panghal, Lovlina Borgohain settle for bronze at Asian Olympic Qualifiers. Boxers Amit Panghal and Lovlina Borgohain won bronze after losing in their respective semi-final matches at the ongoing Asian Olympic Qualifiers in Jordan. However, both the boxers have secured their Olympic berths by virtue of entering the semifinals. Meanwhile, India's Vikas Krishan has entered the final bout in the welterweight 69kg event. ",amit panghal lovlina borgohain settle bronze asian olympic qualifier boxer amit panghal lovlina borgohain win bronze lose respective semi final match ongoing asian olympic qualifier jordan however boxer secure olympic berth virtue enter semifinal meanwhile indias vikas krishan enter final bout welterweight kg event
