news_headline,news_article,news_category,full_text,clean_text
OnePlus to unveil its entire lineup of 5G devices at upcoming launch,"OnePlus has announced that it will be unveiling a full 5G lineup for its upcoming OnePlus 8 series launch. ""We're proud to be among the first smartphone manufacturers to have full 5G line up for our next launch,"" OnePlus Founder and CEO, Pete Lau said. He added that the smartphone experience will 'go through a dramatic development' owing to 5G.",technology,"OnePlus to unveil its entire lineup of 5G devices at upcoming launch. OnePlus has announced that it will be unveiling a full 5G lineup for its upcoming OnePlus 8 series launch. ""We're proud to be among the first smartphone manufacturers to have full 5G line up for our next launch,"" OnePlus Founder and CEO, Pete Lau said. He added that the smartphone experience will 'go through a dramatic development' owing to 5G.",oneplus unveil entire lineup g device upcoming launch oneplus announce unveil full g lineup upcoming oneplus series launch proud among first smartphone manufacturer full g line next launch oneplus founder ceo pete lau say add smartphone experience go dramatic development owe g
Second person ever to be cured of HIV reveals identity,"A 40-year-old man from London named Adam Castillejo is the second person ever to be cleared of HIV, doctors said. Castillejo, who revealed his identity saying he wants to become an ""ambassador of hope"", is free of the virus more than 30 months after stopping antiretroviral therapy. He was cured by a stem-cell treatment he received for blood cancer.",technology,"Second person ever to be cured of HIV reveals identity. A 40-year-old man from London named Adam Castillejo is the second person ever to be cleared of HIV, doctors said. Castillejo, who revealed his identity saying he wants to become an ""ambassador of hope"", is free of the virus more than 30 months after stopping antiretroviral therapy. He was cured by a stem-cell treatment he received for blood cancer.",second person ever cure hiv reveal identity year old man london name adam castillejo second person ever clear hiv doctor say castillejo reveal identity say want become ambassador hope free virus month stop antiretroviral therapy cure stem cell treatment receive blood cancer
Why does coronavirus testing take 15 minutes in China and a day in India?,"As per reports, China, Italy and Japan are using a test developed by US-based company BioMedomics that takes 15 minutes to test a blood sample for coronavirus. BioMedomics claims its test delivers correct response about 80% of the time. In India, a laboratory testing technique called Reverse transcription-polymerase chain reaction (RT-PCR) is used, that takes 24 hours to deliver results. ",technology,"Why does coronavirus testing take 15 minutes in China and a day in India?. As per reports, China, Italy and Japan are using a test developed by US-based company BioMedomics that takes 15 minutes to test a blood sample for coronavirus. BioMedomics claims its test delivers correct response about 80% of the time. In India, a laboratory testing technique called Reverse transcription-polymerase chain reaction (RT-PCR) is used, that takes 24 hours to deliver results. ",coronavirus testing take minute china day india per report china italy japan use test develop us base company biomedomic take minute test blood sample coronavirus biomedomic claim test deliver correct response time india laboratory testing technique call reverse transcription polymerase chain reaction rt pcr use take hour deliver result
Instagram users criticised for creating coronavirus-theme filters,"Several users on Instagram have been criticised for creating coronavirus-themed augmented reality (AR) filters. The filters include face masks, virus molecules floating around and a box that ""determines if you'll contract or die from the coronavirus"". Many people criticised the filters, with one tweeting, ""We're talking about something that is currently killing people! Completely inappropriate.""",technology,"Instagram users criticised for creating coronavirus-theme filters. Several users on Instagram have been criticised for creating coronavirus-themed augmented reality (AR) filters. The filters include face masks, virus molecules floating around and a box that ""determines if you'll contract or die from the coronavirus"". Many people criticised the filters, with one tweeting, ""We're talking about something that is currently killing people! Completely inappropriate.""",instagram user criticise create coronavirus theme filter several user instagram criticise create coronavirus theme augmented reality ar filter filter include face mask virus molecule float around box determine contract die coronavirus many people criticise filter one tweeting talk something currently kill people completely inappropriate
It's safe to clean iPhone with disinfectant wipes: Apple amid coronavirus outbreak,"Apple has updated its website to let iPhone, iPad and Mac owners know it's safe to clean their devices with disinfectant wipes. ""Using a 70% isopropyl alcohol wipe or Clorox Disinfecting Wipes, you may gently wipe the hard, nonporous surfaces of your device,"" Apple said. A report claims that coronavirus can survive on phone screens for up to a week.",technology,"It's safe to clean iPhone with disinfectant wipes: Apple amid coronavirus outbreak. Apple has updated its website to let iPhone, iPad and Mac owners know it's safe to clean their devices with disinfectant wipes. ""Using a 70% isopropyl alcohol wipe or Clorox Disinfecting Wipes, you may gently wipe the hard, nonporous surfaces of your device,"" Apple said. A report claims that coronavirus can survive on phone screens for up to a week.",safe clean iphone disinfectant wipe apple amid coronavirus outbreak apple update website let iphone ipad mac owner know safe clean device disinfectant wipe use isopropyl alcohol wipe clorox disinfecting wipe may gently wipe hard nonporous surface device apple say report claim coronavirus survive phone screen week
Musk runs poll to decide if Tesla's Berlin Gigafactory should have a 'rave cave',"Tesla CEO Elon Musk ran a poll on Twitter on Tuesday to decide if the company's Berlin Gigafactory should have a 'rave cave' with an ""epic sound system and woofers the size of a car"". At the time of writing, the poll received more than 5 lakh votes. A Twitter user wrote, ""Elon, don't forget to bring your dance moves.""",technology,"Musk runs poll to decide if Tesla's Berlin Gigafactory should have a 'rave cave'. Tesla CEO Elon Musk ran a poll on Twitter on Tuesday to decide if the company's Berlin Gigafactory should have a 'rave cave' with an ""epic sound system and woofers the size of a car"". At the time of writing, the poll received more than 5 lakh votes. A Twitter user wrote, ""Elon, don't forget to bring your dance moves.""",musk run poll decide tesla berlin gigafactory rave cave tesla ceo elon musk run poll twitter tuesday decide company berlin gigafactory rave cave epic sound system woofer size car time writing poll receive lakh vote twitter user write elon not forget bring dance move
Jack Dorsey to remain Twitter's CEO as it strikes investment deal with Elliott,"Twitter and activist hedge fund Elliott Management have come to an agreement where Jack Dorsey will remain the social-media firm's CEO, a week after reports said Elliott may remove him from the position. Twitter announced that it has received a $1 billion investment from Silver Lake. It will use the cash on hand towards a $2 billion share repurchase programme. ",technology,"Jack Dorsey to remain Twitter's CEO as it strikes investment deal with Elliott. Twitter and activist hedge fund Elliott Management have come to an agreement where Jack Dorsey will remain the social-media firm's CEO, a week after reports said Elliott may remove him from the position. Twitter announced that it has received a $1 billion investment from Silver Lake. It will use the cash on hand towards a $2 billion share repurchase programme. ",jack dorsey remain twitter ceo strike investment deal elliott twitter activist hedge fund elliott management come agreement jack dorsey remain social medium firm ceo week report say elliott may remove position twitter announce receive billion investment silver lake use cash hand towards billion share repurchase programme
I think college is basically for fun and not for learning: Billionaire Elon Musk,"Tesla's CEO Elon Musk spoke at the Satellite 2020 conference this week, where he said, ""I think college is basically for fun and to prove you can do your chores, but they're not for learning."" He added, ""You can learn anything for free."" Musk also said that he hopes to make sure Tesla does not have university requirements for jobs.",technology,"I think college is basically for fun and not for learning: Billionaire Elon Musk. Tesla's CEO Elon Musk spoke at the Satellite 2020 conference this week, where he said, ""I think college is basically for fun and to prove you can do your chores, but they're not for learning."" He added, ""You can learn anything for free."" Musk also said that he hopes to make sure Tesla does not have university requirements for jobs.",think college basically fun not learn billionaire elon musk tesla ceo elon musk speak satellite conference week say think college basically fun prove chore not learn add learn anything free musk also say hop make sure tesla not university requirement job
Porn site Pornhub accused of profiting from videos of rape and sexual abuse,"An online petition accusing Pornhub of profiting from videos of rape and sexual abuse has reached over 3,50,000 signatures. It demands Pornhub's shutdown and holding its executives accountable for aiding trafficking. ""A 15-year-old girl who had been missing for a year was found after her mother was tipped off that her daughter featured in videos on Pornhub,"" the petition says.",technology,"Porn site Pornhub accused of profiting from videos of rape and sexual abuse. An online petition accusing Pornhub of profiting from videos of rape and sexual abuse has reached over 3,50,000 signatures. It demands Pornhub's shutdown and holding its executives accountable for aiding trafficking. ""A 15-year-old girl who had been missing for a year was found after her mother was tipped off that her daughter featured in videos on Pornhub,"" the petition says.",porn site pornhub accuse profit video rape sexual abuse online petition accuse pornhub profit video rape sexual abuse reach signature demand pornhubs shutdown hold executive accountable aid trafficking year old girl miss year find mother tip daughter feature video pornhub petition say
Escobar Fold 2 phone turns out be Samsung Galaxy Fold with golden sticker,"Several tech reviewers have revealed that Pablo Escobar's brother Roberto Escobar's phone company Escobar Inc, that promised a foldable phone for $399, is scamming buyers. While most of the buyers never received their phone, a few people who received the phone realised it was actually Samsung's Galaxy Fold smartphone. It was covered with a golden sticker to hide Samsung's branding.",technology,"Escobar Fold 2 phone turns out be Samsung Galaxy Fold with golden sticker. Several tech reviewers have revealed that Pablo Escobar's brother Roberto Escobar's phone company Escobar Inc, that promised a foldable phone for $399, is scamming buyers. While most of the buyers never received their phone, a few people who received the phone realised it was actually Samsung's Galaxy Fold smartphone. It was covered with a golden sticker to hide Samsung's branding.",escobar fold phone turn samsung galaxy fold golden sticker several tech reviewer reveal pablo escobar brother roberto escobar phone company escobar inc promise foldable phone scamm buyer buyer never receive phone people receive phone realise actually samsung galaxy fold smartphone cover golden sticker hide samsung branding
US billionaire used face recognition app to identify man his daughter dined with,"US billionaire John Catsimatidis, the owner of Gristedes grocery store chain, used controversial facial recognition startup Clearview AI's app to identify a man his daughter was on a date with, The New York Times reported. In 2018, John's daughter arrived at a restaurant with a man. John asked a waiter to take his picture and identified him with the app.",technology,"US billionaire used face recognition app to identify man his daughter dined with. US billionaire John Catsimatidis, the owner of Gristedes grocery store chain, used controversial facial recognition startup Clearview AI's app to identify a man his daughter was on a date with, The New York Times reported. In 2018, John's daughter arrived at a restaurant with a man. John asked a waiter to take his picture and identified him with the app.",us billionaire use face recognition app identify man daughter din us billionaire john catsimatidis owner gristede grocery store chain use controversial facial recognition startup clearview ais app identify man daughter date new york time report johns daughter arrive restaurant man john ask waiter take picture identify app
Secret-sharing app 'Whisper' left data of millions of users exposed for years,"'Whisper', a secret-sharing app available on both Android and iOS platforms that let users share photo and video messages anonymously, left personal data of hundreds of millions of users unprotected for years, The Washington Post reported. The database had sensitive information like age, location, gender and even the nicknames. 'Whisper' ranks 103rd in the social media category on App Store.",technology,"Secret-sharing app 'Whisper' left data of millions of users exposed for years. 'Whisper', a secret-sharing app available on both Android and iOS platforms that let users share photo and video messages anonymously, left personal data of hundreds of millions of users unprotected for years, The Washington Post reported. The database had sensitive information like age, location, gender and even the nicknames. 'Whisper' ranks 103rd in the social media category on App Store.",secret share app whisper leave datum million user expose year whisper secret sharing app available android ios platform let user share photo video message anonymously leave personal datum hundred million user unprotect year washington post report database sensitive information like age location gender even nickname whisper rank rd social medium category app store
Work from home: Google tells all North American employees amid coronavirus,"Google on Tuesday asked all its North American employees to work from home until at least April 10 if their role permits. Google had already given a similar guideline to its Bay Area employees. Google is also establishing a COVID-19 fund, by which all its temporary staff and vendors can take paid sick leave if they show symptoms of coronavirus.",technology,"Work from home: Google tells all North American employees amid coronavirus. Google on Tuesday asked all its North American employees to work from home until at least April 10 if their role permits. Google had already given a similar guideline to its Bay Area employees. Google is also establishing a COVID-19 fund, by which all its temporary staff and vendors can take paid sick leave if they show symptoms of coronavirus.",work home google tell north american employee amid coronavirus google tuesday ask north american employee work home least april role permit google already give similar guideline bay area employee google also establish covid fund temporary staff vendor take pay sick leave show symptom coronavirus
Amazon begins selling its cashierless store technology to other retailers,"Amazon will offer its cashierless store technology called 'Just Walk Out' to other retailers. The technology uses a combination of cameras, sensors, computer vision techniques and deep learning to allow customers to shop and leave the store without waiting in line to pay. The setup and installation of the system can take as little as a few weeks, Amazon says.",technology,"Amazon begins selling its cashierless store technology to other retailers. Amazon will offer its cashierless store technology called 'Just Walk Out' to other retailers. The technology uses a combination of cameras, sensors, computer vision techniques and deep learning to allow customers to shop and leave the store without waiting in line to pay. The setup and installation of the system can take as little as a few weeks, Amazon says.",amazon begin sell cashierless store technology retailer amazon offer cashierless store technology call walk retailer technology use combination camera sensor computer vision technique deep learning allow customer shop leave store without wait line pay setup installation system take little week amazon say
Startup builds wristband that buzzes to stop wearer from touching their face,"A US-based startup called Slightly Robot has developed a wristband to help users stop touching their eyes, nose and mouth, which has been recommended as a preventative measure amid the coronavirus outbreak. The device, named Immutouch, vibrates when the wearer brings their hand close to their face to break the habit. Its accelerometer senses hand movement 10 times per second.",technology,"Startup builds wristband that buzzes to stop wearer from touching their face. A US-based startup called Slightly Robot has developed a wristband to help users stop touching their eyes, nose and mouth, which has been recommended as a preventative measure amid the coronavirus outbreak. The device, named Immutouch, vibrates when the wearer brings their hand close to their face to break the habit. Its accelerometer senses hand movement 10 times per second.",startup build wristband buzz stop wearer touch face us base startup call slightly robot develop wristband help user stop touch eye nose mouth recommend preventative measure amid coronavirus outbreak device name immutouch vibrate wearer bring hand close face break habit accelerometer sense hand movement time per second
Google creates fund to support temporary staff with COVID-19 symptoms ,Google has created a fund for all its temporary staff and vendors worldwide who would take paid leave if they have symptoms of coronavirus. Google has told employees across offices in North America to work from home to contain the spread of the virus. A Google employee has been tested positive after he spent time in the company's Zurich office.,technology,Google creates fund to support temporary staff with COVID-19 symptoms . Google has created a fund for all its temporary staff and vendors worldwide who would take paid leave if they have symptoms of coronavirus. Google has told employees across offices in North America to work from home to contain the spread of the virus. A Google employee has been tested positive after he spent time in the company's Zurich office.,google create fund support temporary staff covid symptom google create fund temporary staff vendor worldwide would take pay leave symptom coronavirus google tell employee across office north america work home contain spread virus google employee test positive spend time companys zurich office
"Gates, Wellcome, Mastercard launch $125-mn initiative to curb COVID-19","The Bill & Melinda Gates Foundation, Wellcome and Mastercard have announced an initiative to curb coronavirus outbreak by speeding up preventive and recovery measures. The project will provide ""equitable access, including making products available and affordable in low-resource settings."" Gates Foundation and Wellcome will contribute $50 million each and Mastercard will contribute $25 million.",technology,"Gates, Wellcome, Mastercard launch $125-mn initiative to curb COVID-19. The Bill & Melinda Gates Foundation, Wellcome and Mastercard have announced an initiative to curb coronavirus outbreak by speeding up preventive and recovery measures. The project will provide ""equitable access, including making products available and affordable in low-resource settings."" Gates Foundation and Wellcome will contribute $50 million each and Mastercard will contribute $25 million.",gate wellcome mastercard launch mn initiative curb covid bill melinda gate foundation wellcome mastercard announce initiative curb coronavirus outbreak speed preventive recovery measure project provide equitable access include make product available affordable low resource setting gate foundation wellcome contribute million mastercard contribute million
Samsung Display asks Vietnam to exempt 700 S Korean workers from quarantine,"Samsung Display has asked Vietnam to exempt 700 workers from South Korea from mandatory quarantine due to coronavirus outbreak if they present medical examination reports. Samsung Display said that they need the workforce to make screens for upcoming smartphones. Vietnam has made a 14-day quarantine compulsory for people coming from South Korea, where over 7,500 cases have been reported.",technology,"Samsung Display asks Vietnam to exempt 700 S Korean workers from quarantine. Samsung Display has asked Vietnam to exempt 700 workers from South Korea from mandatory quarantine due to coronavirus outbreak if they present medical examination reports. Samsung Display said that they need the workforce to make screens for upcoming smartphones. Vietnam has made a 14-day quarantine compulsory for people coming from South Korea, where over 7,500 cases have been reported.",samsung display ask vietnam exempt korean worker quarantine samsung display ask vietnam exempt worker south korea mandatory quarantine due coronavirus outbreak present medical examination report samsung display say need workforce make screen upcoming smartphone vietnam make day quarantine compulsory people come south korea case report
"Musk celebrates Tesla making its one-millionth car, shares pic with employees","Tesla has reached its goal of making one million electric vehicles, Elon Musk announced on Twitter as he shared the picture of the one-millionth car which is a red Tesla Model Y. ""Congratulations Tesla team on making our 1,000,000th car!!"" Musk wrote. Tesla, founded in 2003, released its first consumer car in 2008, called the Roadster.",technology,"Musk celebrates Tesla making its one-millionth car, shares pic with employees. Tesla has reached its goal of making one million electric vehicles, Elon Musk announced on Twitter as he shared the picture of the one-millionth car which is a red Tesla Model Y. ""Congratulations Tesla team on making our 1,000,000th car!!"" Musk wrote. Tesla, founded in 2003, released its first consumer car in 2008, called the Roadster.",musk celebrate tesla make one millionth car share pic employee tesla reach goal make one million electric vehicle elon musk announce twitter share picture one millionth car red tesla model congratulation tesla team make th car musk write tesla found release first consumer car call roadster
Hackers targeting other hackers by infecting their tools with malware: Report,"For years, hackers have been targeting other hackers by injecting popular hacking tools with powerful remote-access trojan, said cybersecurity firm Cybereason's Amit Serper. He said the attackers ""bait"" other hackers by then posting these repackaged tools on hacking forums. When the tools are opened, hackers gain full access to the target's computer and backdoor to any system breached by them.",technology,"Hackers targeting other hackers by infecting their tools with malware: Report. For years, hackers have been targeting other hackers by injecting popular hacking tools with powerful remote-access trojan, said cybersecurity firm Cybereason's Amit Serper. He said the attackers ""bait"" other hackers by then posting these repackaged tools on hacking forums. When the tools are opened, hackers gain full access to the target's computer and backdoor to any system breached by them.",hacker target hacker infect tool malware report year hacker target hacker inject popular hacking tool powerful remote access trojan say cybersecurity firm cybereason amit serper say attacker bait hacker post repackaged tool hack forum tool open hacker gain full access target computer backdoor system breach
Apple's tracking device 'AirTag' may have coin-shaped removable cell: Report,"Apple's rumoured bluetooth tracking device, AirTag, may feature a removable CR2032 coin cell battery, a report said. It was earlier rumoured that the tags would feature a magnetic wireless charging similar to the Apple Watch. AirTag will reportedly be a waterproof device which would help users keep track of their personal belongings, such as their keys, wallets and backpacks.",technology,"Apple's tracking device 'AirTag' may have coin-shaped removable cell: Report. Apple's rumoured bluetooth tracking device, AirTag, may feature a removable CR2032 coin cell battery, a report said. It was earlier rumoured that the tags would feature a magnetic wireless charging similar to the Apple Watch. AirTag will reportedly be a waterproof device which would help users keep track of their personal belongings, such as their keys, wallets and backpacks.",apple track device airtag may coin shape removable cell report apple rumour bluetooth tracking device airtag may feature removable cr coin cell battery report say earlier rumour tag would feature magnetic wireless charge similar apple watch airtag reportedly waterproof device would help user keep track personal belonging key wallet backpack
